link,text,date,Likes,Comments
https://twitter.com/JitendraM_Bassi/status/1540935182479663104#m,"рдЗрд╕реА рддрд░рд╣, рдмреЗрдВрдЧрд▓реБрд░реБ рдХреЗ рдПрдХ Space Start-Up Astrome рдХреА founder рдиреЗрд╣рд╛ рднреА рдПрдХ рдХрдорд╛рд▓ рдХреЗ idea рдкрд░ рдХрд╛рдо рдХрд░ рд░рд╣реА рд╣реИрдВред  рдпреЗ Start-Up рдРрд╕реЗ Flat Antenna рдмрдирд╛ рд░рд╣рд╛ рд╣реИ рдЬреЛ рди рдХреЗрд╡рд▓ рдЫреЛрдЯреЗ рд╣реЛрдВрдЧреЗ, рдмрд▓реНрдХрд┐ рдЙрдирдХреА Cost рднреА рдХрд╛рдлреА рдХрдо рд╣реЛрдЧреАред  рдЗрд╕ Technology рдХреА Demand рдкреВрд░реА рджреБрдирд┐рдпрд╛ рдореЗрдВ рд╣реЛ рд╕рдХрддреА рд╣реИред  #MannKiBaat","Jun 26, 2022 ┬╖ 5:49 AM UTC",0,0
https://twitter.com/BJP4Rajasthan/status/1540935156592439296#m,"рдЗрд╕реА рддрд░рд╣, рдмреЗрдВрдЧрд▓реБрд░реБ рдХреЗ рдПрдХ Space Start-Up Astrome рдХреА founder рдиреЗрд╣рд╛ рднреА рдПрдХ рдХрдорд╛рд▓ рдХреЗ idea рдкрд░ рдХрд╛рдо рдХрд░ рд░рд╣реА рд╣реИрдВред  рдпреЗ Start-Up рдРрд╕реЗ Flat Antenna рдмрдирд╛ рд░рд╣рд╛ рд╣реИ рдЬреЛ рди рдХреЗрд╡рд▓ рдЫреЛрдЯреЗ рд╣реЛрдВрдЧреЗ, рдмрд▓реНрдХрд┐ рдЙрдирдХреА Cost рднреА рдХрд╛рдлреА рдХрдо рд╣реЛрдЧреАред  рдЗрд╕ Technology рдХреА Demand рдкреВрд░реА рджреБрдирд┐рдпрд╛ рдореЗрдВ рд╣реЛ рд╕рдХрддреА рд╣реИред  #MannKiBaat","Jun 26, 2022 ┬╖ 5:49 AM UTC",29,2
https://twitter.com/drmanojrajoria/status/1540935154348466177#m,"рдЗрд╕реА рддрд░рд╣, рдмреЗрдВрдЧрд▓реБрд░реБ рдХреЗ рдПрдХ Space Start-Up Astrome рдХреА founder рдиреЗрд╣рд╛ рднреА рдПрдХ рдХрдорд╛рд▓ рдХреЗ idea рдкрд░ рдХрд╛рдо рдХрд░ рд░рд╣реА рд╣реИрдВред  рдпреЗ Start-Up рдРрд╕реЗ Flat Antenna рдмрдирд╛ рд░рд╣рд╛ рд╣реИ рдЬреЛ рди рдХреЗрд╡рд▓ рдЫреЛрдЯреЗ рд╣реЛрдВрдЧреЗ, рдмрд▓реНрдХрд┐ рдЙрдирдХреА Cost рднреА рдХрд╛рдлреА рдХрдо рд╣реЛрдЧреАред  рдЗрд╕ Technology рдХреА Demand рдкреВрд░реА рджреБрдирд┐рдпрд╛ рдореЗрдВ рд╣реЛ рд╕рдХрддреА рд╣реИред  #MannKiBaat","Jun 26, 2022 ┬╖ 5:49 AM UTC",1,0
https://twitter.com/BJP4Delhi/status/1540935133917638656#m,"рдЗрд╕реА рддрд░рд╣, рдмреЗрдВрдЧрд▓реБрд░реБ рдХреЗ рдПрдХ Space Start-Up Astrome рдХреА founder рдиреЗрд╣рд╛ рднреА рдПрдХ рдХрдорд╛рд▓ рдХреЗ idea рдкрд░ рдХрд╛рдо рдХрд░ рд░рд╣реА рд╣реИрдВред  рдпреЗ Start-Up рдРрд╕реЗ Flat Antenna рдмрдирд╛ рд░рд╣рд╛ рд╣реИ рдЬреЛ рди рдХреЗрд╡рд▓ рдЫреЛрдЯреЗ рд╣реЛрдВрдЧреЗ, рдмрд▓реНрдХрд┐ рдЙрдирдХреА Cost рднреА рдХрд╛рдлреА рдХрдо рд╣реЛрдЧреАред  рдЗрд╕ Technology рдХреА Demand рдкреВрд░реА рджреБрдирд┐рдпрд╛ рдореЗрдВ рд╣реЛ рд╕рдХрддреА рд╣реИред  #MannKiBaat","Jun 26, 2022 ┬╖ 5:48 AM UTC",26,0
https://twitter.com/vdsharmabjp/status/1540935129471692800#m,"рдЗрд╕реА рддрд░рд╣, рдмреЗрдВрдЧрд▓реБрд░реБ рдХреЗ рдПрдХ Space Start-Up Astrome рдХреА founder рдиреЗрд╣рд╛ рднреА рдПрдХ рдХрдорд╛рд▓ рдХреЗ idea рдкрд░ рдХрд╛рдо рдХрд░ рд░рд╣реА рд╣реИрдВред  рдпреЗ Start-Up рдРрд╕реЗ Flat Antenna рдмрдирд╛ рд░рд╣рд╛ рд╣реИ рдЬреЛ рди рдХреЗрд╡рд▓ рдЫреЛрдЯреЗ рд╣реЛрдВрдЧреЗ, рдмрд▓реНрдХрд┐ рдЙрдирдХреА Cost рднреА рдХрд╛рдлреА рдХрдо рд╣реЛрдЧреАред  рдЗрд╕ Technology рдХреА Demand рдкреВрд░реА рджреБрдирд┐рдпрд╛ рдореЗрдВ рд╣реЛ рд╕рдХрддреА рд╣реИред  #MannKiBaat","Jun 26, 2022 ┬╖ 5:48 AM UTC",37,0
https://twitter.com/SaurabhSainiBJP/status/1540935093128396800#m,"рдЗрд╕реА рддрд░рд╣, рдмреЗрдВрдЧрд▓реБрд░реБ рдХреЗ рдПрдХ Space Start-Up Astrome рдХреА founder рдиреЗрд╣рд╛ рднреА рдПрдХ рдХрдорд╛рд▓ рдХреЗ idea рдкрд░ рдХрд╛рдо рдХрд░ рд░рд╣реА рд╣реИрдВред  рдпреЗ Start-Up рдРрд╕реЗ Flat Antenna рдмрдирд╛ рд░рд╣рд╛ рд╣реИ рдЬреЛ рди рдХреЗрд╡рд▓ рдЫреЛрдЯреЗ рд╣реЛрдВрдЧреЗ, рдмрд▓реНрдХрд┐ рдЙрдирдХреА Cost рднреА рдХрд╛рдлреА рдХрдо рд╣реЛрдЧреАред  рдЗрд╕ Technology рдХреА Demand рдкреВрд░реА рджреБрдирд┐рдпрд╛ рдореЗрдВ рд╣реЛ рд╕рдХрддреА рд╣реИред  #MannKiBaat","Jun 26, 2022 ┬╖ 5:48 AM UTC",1,0
https://twitter.com/BJP4MP/status/1540935089231523842#m,"рдЗрд╕реА рддрд░рд╣, рдмреЗрдВрдЧрд▓реБрд░реБ рдХреЗ рдПрдХ Space Start-Up Astrome рдХреА founder рдиреЗрд╣рд╛ рднреА рдПрдХ рдХрдорд╛рд▓ рдХреЗ idea рдкрд░ рдХрд╛рдо рдХрд░ рд░рд╣реА рд╣реИрдВред  рдпреЗ Start-Up рдРрд╕реЗ Flat Antenna рдмрдирд╛ рд░рд╣рд╛ рд╣реИ рдЬреЛ рди рдХреЗрд╡рд▓ рдЫреЛрдЯреЗ рд╣реЛрдВрдЧреЗ, рдмрд▓реНрдХрд┐ рдЙрдирдХреА Cost рднреА рдХрд╛рдлреА рдХрдо рд╣реЛрдЧреАред  рдЗрд╕ Technology рдХреА Demand рдкреВрд░реА рджреБрдирд┐рдпрд╛ рдореЗрдВ рд╣реЛ рд╕рдХрддреА рд╣реИред  #MannKiBaat","Jun 26, 2022 ┬╖ 5:48 AM UTC",18,0
https://twitter.com/BJPLive/status/1540935059569790976#m,"рдЗрд╕реА рддрд░рд╣, рдмреЗрдВрдЧрд▓реБрд░реБ рдХреЗ рдПрдХ Space Start-Up Astrome рдХреА founder рдиреЗрд╣рд╛ рднреА рдПрдХ рдХрдорд╛рд▓ рдХреЗ idea рдкрд░ рдХрд╛рдо рдХрд░ рд░рд╣реА рд╣реИрдВред  рдпреЗ Start-Up рдРрд╕реЗ Flat Antenna рдмрдирд╛ рд░рд╣рд╛ рд╣реИ рдЬреЛ рди рдХреЗрд╡рд▓ рдЫреЛрдЯреЗ рд╣реЛрдВрдЧреЗ, рдмрд▓реНрдХрд┐ рдЙрдирдХреА Cost рднреА рдХрд╛рдлреА рдХрдо рд╣реЛрдЧреАред  рдЗрд╕ Technology рдХреА Demand рдкреВрд░реА рджреБрдирд┐рдпрд╛ рдореЗрдВ рд╣реЛ рд╕рдХрддреА рд╣реИред  #MannKiBaat","Jun 26, 2022 ┬╖ 5:48 AM UTC",17,0
https://twitter.com/BJP4India/status/1540934984873127936#m,"рдЗрд╕реА рддрд░рд╣, рдмреЗрдВрдЧрд▓реБрд░реБ рдХреЗ рдПрдХ Space Start-Up Astrome рдХреА founder рдиреЗрд╣рд╛ рднреА рдПрдХ рдХрдорд╛рд▓ рдХреЗ idea рдкрд░ рдХрд╛рдо рдХрд░ рд░рд╣реА рд╣реИрдВред  рдпреЗ Start-Up рдРрд╕реЗ Flat Antenna рдмрдирд╛ рд░рд╣рд╛ рд╣реИ рдЬреЛ рди рдХреЗрд╡рд▓ рдЫреЛрдЯреЗ рд╣реЛрдВрдЧреЗ, рдмрд▓реНрдХрд┐ рдЙрдирдХреА Cost рднреА рдХрд╛рдлреА рдХрдо рд╣реЛрдЧреАред  рдЗрд╕ Technology рдХреА Demand рдкреВрд░реА рджреБрдирд┐рдпрд╛ рдореЗрдВ рд╣реЛ рд╕рдХрддреА рд╣реИред  #MannKiBaat","Jun 26, 2022 ┬╖ 5:48 AM UTC",372,3
https://twitter.com/Journalistkabir/status/1540932872223494144#m,"""рдЗрд╕реА рддрд░рд╣, рдмреЗрдВрдЧрд▓реБрд░реБ рдХреЗ рдПрдХ Space Start-Up Astrome рдХреА founder рдиреЗрд╣рд╛ рднреА рдПрдХ рдХрдорд╛рд▓ рдХреЗ idea рдкрд░ рдХрд╛рдо рдХрд░ рд░рд╣реА рд╣реИрдВ | рдпреЗ Start-Up рдРрд╕реЗ Flat Antenna рдмрдирд╛ рд░рд╣рд╛ рд╣реИ рдЬреЛ рди рдХреЗрд╡рд▓ рдЫреЛрдЯреЗ рд╣реЛрдВрдЧреЗ, рдмрд▓реНрдХрд┐ рдЙрдирдХреА Cost рднреА рдХрд╛рдлреА рдХрдо рд╣реЛрдЧреА |""  - рдкреАрдПрдо @narendramodi.  #MannKiBaat @ChhapraToday","Jun 26, 2022 ┬╖ 5:40 AM UTC",0,0
https://twitter.com/mannkibaat/status/1540932770062405632#m,"""рдЗрд╕реА рддрд░рд╣, рдмреЗрдВрдЧрд▓реБрд░реБ рдХреЗ рдПрдХ Space Start-Up Astrome рдХреА founder рдиреЗрд╣рд╛ рднреА рдПрдХ рдХрдорд╛рд▓ рдХреЗ idea рдкрд░ рдХрд╛рдо рдХрд░ рд░рд╣реА рд╣реИрдВ | рдпреЗ Start-Up рдРрд╕реЗ Flat Antenna рдмрдирд╛ рд░рд╣рд╛ рд╣реИ рдЬреЛ рди рдХреЗрд╡рд▓ рдЫреЛрдЯреЗ рд╣реЛрдВрдЧреЗ, рдмрд▓реНрдХрд┐ рдЙрдирдХреА Cost рднреА рдХрд╛рдлреА рдХрдо рд╣реЛрдЧреА |""  - рдкреАрдПрдо @narendramodi.  #MannKiBaat","Jun 26, 2022 ┬╖ 5:39 AM UTC",44,1
https://twitter.com/BenOmonuberu/status/1540931095444615168#m,Investors are needed to provide funding support for a start-up e-commerce business idea in Nigerian market space https://lnkd.in/gaVAsXx6,"Jun 26, 2022 ┬╖ 5:32 AM UTC",0,0
https://twitter.com/DavidPicasso4/status/1540926940487356416#m,"You need the freedom to fail, people who will invest in crazy ideas, capable people who are willing to work for future profits, and customers will take a chance on a start-up enterprise. Other countries don't have this.","Jun 26, 2022 ┬╖ 5:16 AM UTC",1,0
https://twitter.com/icecollar/status/1540912697163714560#m,"I think i have One of the Greatest ideas for a ""Start-up""","Jun 26, 2022 ┬╖ 4:19 AM UTC",1,2
https://twitter.com/RESTRlCK/status/1540815036528357377#m,pspsps start-up / siIicon valley / tech mfs come look at this billion dollar ideaтА╝я╕ПЁЯдгЁЯдг,"Jun 25, 2022 ┬╖ 9:51 PM UTC",0,0
https://twitter.com/absarkalathingl/status/1540762260813258752#m,New start-up idea: Buying and Selling MLAs and arranging rooms for them,"Jun 25, 2022 ┬╖ 6:22 PM UTC",4,1
https://twitter.com/QCGov/status/1540736552615419904#m,"Nais din ng lokal na pamahalaan na mabigyan ng pagkakataong maisakatuparan ang business idea ng mga QCitizen, sa tulong ng Start-Up QC.   Tinulungan ding i-promote ang mga small businesses na Tatak QC, sa pamamagitan ng Made in QC at mall caravans.","Jun 25, 2022 ┬╖ 4:39 PM UTC",2,1
https://twitter.com/Wealthy_Brains/status/1540678898710487047#m,"It's like startup ideas.  When an idea get initial success. 100s of start-ups simply trybto copy it.   But, it's the speed, faster execution and faster iterations of the start-up with original idea that makes it unicorn out of competition. 1/..","Jun 25, 2022 ┬╖ 12:50 PM UTC",1,1
https://twitter.com/Humanoid_XAI314/status/1540598047616278528#m,@Parsaivyangy Start-up Idea - A digital market place for legislators. The identity will be disclosed only after the offer is accepted :P,"Jun 25, 2022 ┬╖ 7:29 AM UTC",0,0
https://twitter.com/joincohart/status/1540483252128886784#m,We're honored to have @saba as an early adopter!!! Follow Saba Says for all the start-up knowledge you'll ever need to bring your ideas to life.,"Jun 24, 2022 ┬╖ 11:53 PM UTC",3,0
https://twitter.com/Comparingly/status/1540473249716473856#m,"How long would you sleep on your dreams?  Wake-up, start-up!   HereтАЩs a list of startup business ideas for you, ignite the growth engines and fly to new heights ->  https://lttr.ai/ymRy #business #businessideas #entrepreneurship #entrepreneurs #growthromeo @growthromeo","Jun 24, 2022 ┬╖ 11:13 PM UTC",1,0
https://twitter.com/MEDLANDOFFICIAL/status/1540465242530004992#m,"Whole crypto system is still like a start-up incubator. Not really finding the path onwards. Iterative testing of vast amount ideas is an evolutionary mechanism. So, for sure, sooner or later something useful will pop-up.","Jun 24, 2022 ┬╖ 10:41 PM UTC",1,0
https://twitter.com/HALOConsulting_/status/1540417922241372161#m,Do you have the next start-up idea? ЁЯТнЁЯТбЁЯТн  The Halo Spotlight features Halo Consulting's Founders as they discuss the inception of Halo Consulting from the ground up while in a global pandemic.   #halo #haloconsulting #executivesearch #Entrepreneurship #diversityandinclusion,"Jun 24, 2022 ┬╖ 7:33 PM UTC",2,0
https://twitter.com/mircomusolesi/status/1540408237719138304#m,Btw a pancake quality classifier is a potential start-up idea. I am in the right place to get VC money.,"Jun 24, 2022 ┬╖ 6:55 PM UTC",1,0
https://twitter.com/strictly_stable/status/1540387446596198400#m,"Hahaha, kasmay ek dum sy full start-up idea b a gya, but mujy pta baad mai sirf mai ny he install krni ye app ЁЯдгЁЯдгЁЯдг","Jun 24, 2022 ┬╖ 5:32 PM UTC",1,1
https://twitter.com/oyeariba/status/1540381678375473153#m,The start-up idea I dropped but someone is working on that same idea with good margins..ЁЯШв,"Jun 24, 2022 ┬╖ 5:09 PM UTC",1,1
https://twitter.com/LindseyNagy/status/1540364797937688576#m,Do you have a #GrandEureka?! Share the big idea that you want to start-up and let @LindseyNagy / @NagyVentures know how we can help! LindseyNagy.com #GrandEurekas,"Jun 24, 2022 ┬╖ 4:02 PM UTC",0,0
https://twitter.com/SkyeQuadri/status/1540364449185497092#m,"70% of students already have the idea now. But, we need money as start-up.","Jun 24, 2022 ┬╖ 4:01 PM UTC",0,0
https://twitter.com/stefan_rottler/status/1540353238809051136#m,"9/ scaling a tech start-up today vs. in the 90's  ""succeeding as a start-up is as hard as itтАЩs ever been, because the same fundamental dynamic is in play. YouтАЩve got some idea of why the world should change, but the world doesnтАЩt want to.""","Jun 24, 2022 ┬╖ 3:16 PM UTC",0,1
https://twitter.com/sparks42/status/1540317157048913920#m,Blockchain start-up? Ground-breaking idea?   Succeed fast  ЁЯСЗЁЯСЗЁЯСЗЁЯСЗ,"Jun 24, 2022 ┬╖ 12:53 PM UTC",2,0
https://twitter.com/vivelacar_de/status/1540305572335075329#m,"#ViveLaCar x Start-Up Week D├╝sseldorf Intriguing conversations, motivating start-ups, and innovative ideas! As part of the start-up week, we had the opportunity to discuss the attractiveness of start-ups and their impact on enterprise companies at this week's #GROWW festival","Jun 24, 2022 ┬╖ 12:07 PM UTC",2,0
https://twitter.com/ABANAngels/status/1540277929615278080#m,"Do you understand the nature of a #startup? This is what 'Tomi Davies @TomiDee  says тАУ The whole idea when building up a start-up is that you are building a money-making machine. Investors put money in, it multiplies the money, and then at some exit point, they take the money out","Jun 24, 2022 ┬╖ 10:17 AM UTC",20,2
https://twitter.com/Firstport/status/1540273730697547778#m,"We are ScotlandтАЩs agency for start-up social entrepreneurs and social enterprise - we're here to support individuals all across Scotland to start, develop and grow their ideas into businesses with social impact at their core. Get in touch to find out more.","Jun 24, 2022 ┬╖ 10:00 AM UTC",1,0
https://twitter.com/JacobMpaka1/status/1540272510704443394#m,Start-up idea here.,"Jun 24, 2022 ┬╖ 9:55 AM UTC",0,0
https://twitter.com/BangaloreHudugi/status/1540270069150011392#m,"Start-up idea: A startup that hires IT professionals who are athletes of any discipline, arts, or creative fields as a hobby as a mandatory criteria & funds it as well.","Jun 24, 2022 ┬╖ 9:46 AM UTC",4,0
https://twitter.com/StartUpLoansUK/status/1540269753851416576#m,Looking to get your business idea off the ground or want to expand your start-up to achieve more?   A business loan could help to finance your start-up plans #StartUpLoans #SmallBusiness https://www.startuploans.co.uk/business-advice/how-to-apply-for-a-loan-for-your-start-up-business/,"Jun 24, 2022 ┬╖ 9:45 AM UTC",1,1
https://twitter.com/Block_Dojo/status/1540254435913465856#m,"Our goal is to help all blockchain start-ups in our incubator programme succeed, and succeed fast, and we do everything we can to make this happen. If you're an early-stage tech start-up or have a ground-breaking idea we want to hear from you. Apply today blockdojo.io/apply-to-incubaтАж","Jun 24, 2022 ┬╖ 8:44 AM UTC",9,0
https://twitter.com/PaulAtApex/status/1540248360514461696#m,Got a start-up idea? Test it using PPC - @slideshare slideshare.net/ivanmelvin/hoтАж - ow.ly/kkX9B,"Jun 24, 2022 ┬╖ 8:20 AM UTC",0,0
https://twitter.com/rjournal/status/1540237287526629376#m,"тАЬWe want to hear from the innovators, anyone with an idea thatтАЩs in motion or a start-up with an exciting new product that could cause a stir in the sector.""  https://www.rhyljournal.co.uk/news/20232745.north-wales-pet-retailer-will-strengthen-links-businesses-improve-animal-health/","Jun 24, 2022 ┬╖ 7:36 AM UTC",0,0
https://twitter.com/NSBDAA/status/1540234474063028226#m,Start-up idea: make similar products in Heart shape.  #startup,"Jun 24, 2022 ┬╖ 7:24 AM UTC",1,0
https://twitter.com/kamauwawangari/status/1540213694994546689#m,"You have missed the point on this one. The reason Kenyans are questioning this, is because it's another case of a foreigner coming here, being able to easily access start-up funding for an idea that wasn't well thought through, while locals can't do the same for great ideas.","Jun 24, 2022 ┬╖ 6:02 AM UTC",46,5
https://twitter.com/Lungi_Jiyane/status/1540172837792763905#m,"Dear Start-up entrepreneur, there'll be a lot of negative people in this journey called entrepreneurship. Some will tell you that your ideas wont work and some will tell you to get a job. Don't listen to them. God will never give you a vision that you can't accomplish.","Jun 24, 2022 ┬╖ 3:19 AM UTC",20,1
https://twitter.com/harshp482836/status/1540166233789571073#m,*Start up Note* :- A start-up requires strong intentions along with a good idea.  #MorningMotivation #startup,"Jun 24, 2022 ┬╖ 2:53 AM UTC",5,0
https://twitter.com/ImLivinTheMeme/status/1540106946270871552#m,"Gov. JB Pritzker parades around his grassroots, get-your-hands-dirty, business bonafides saying he FOUNDED start-up incubator 1871.   He didnтАЩt.   He FUNDED it.   Big difference.   Funding that is nothing to sneeze at. Be heтАЩs in love with the idea of being the founder.","Jun 23, 2022 ┬╖ 10:58 PM UTC",0,0
https://twitter.com/Iambiwott/status/1540078113924587522#m,тАЬ2/3тАЭ The Start-Up focused much on brand equity than #prototyping the idea before scaling.  Prototyping gives us a better understanding of the potential risks that our Start-Ups could face. We can use this clarity to develop our ideas ЁЯТбfurther.,"Jun 23, 2022 ┬╖ 9:03 PM UTC",1,1
https://twitter.com/Wasteman_Bot/status/1540041359024717824#m,dutty times think I'm in heaven bruv discussing start-up ideas while puffing on dat sweet afghan kush and huffing paint ..hold tight my boi Benson!,"Jun 23, 2022 ┬╖ 6:37 PM UTC",1,0
https://twitter.com/sallyjohnson_/status/1540008939265351682#m,"How long would you sleep on your dreams?  Wake-up, start-up!   HereтАЩs a list of startup business ideas for you, ignite the growth engines and fly to new heights ->  https://lttr.ai/yiXv #business #businessideas #entrepreneurship #entrepreneurs #growthromeo @growthromeo","Jun 23, 2022 ┬╖ 4:28 PM UTC",1,0
https://twitter.com/GoMobileFirst/status/1540000144661282818#m,How to select #customers to validate #B2B start-up idea? ┬а What works 1- Find 10+ diverse customers - I prefer 35% early adopters of new technologies 2- Prepare and share a 1-2 pager to visualize the idea and help you stay focused  3- Actively listen andтАжhttps://lnkd.in/daNEZtFT,"Jun 23, 2022 ┬╖ 3:53 PM UTC",0,0
https://twitter.com/ESBiomech/status/1539996830200500224#m,"9. Speaking of prizes, the #ESBiomech2022 is also holding a start-up competition!  Teams selected for the final phase will have the chance to present their business idea to a panel of experts and potential investors.","Jun 23, 2022 ┬╖ 3:40 PM UTC",2,1
https://twitter.com/TUDublin_RI/status/1539972715741777932#m,Apply today for the @Entirl @EI_NewFrontiers Phase 1 Programme with @WeAreTUDublin @Hothouse_TUDub  via:  https://www.tudublin.ie/research/innovation-and-enterprise/new-frontiers/apply-now/  Want to grow your idea into a successful start-up? Apply today to see how we can help!  #TUDublinInnovation #GlobalAmbition #WeAreTUDublin,"Jun 23, 2022 ┬╖ 2:04 PM UTC",7,0
https://twitter.com/ColbeaBizAdvice/status/1539941860042481664#m,"Our free online training course тАУ First Steps to Start-Up Success тАУ is open for bookings!  If youтАЩve got an idea for a new business or have just started one, this course will be perfect for you.   More info and booking link: https://bit.ly/3FDgiIB","Jun 23, 2022 ┬╖ 12:02 PM UTC",0,0
https://twitter.com/joyan1516/status/1539920888191139840#m,"@midjourney ""a commercial from the future of synthetic biology"" gave me a protein 3D printer. A possible start-up idea anyone?","Jun 23, 2022 ┬╖ 10:38 AM UTC",0,0
https://twitter.com/StHelensChamber/status/1539911337354137600#m,"Business Start-up of the Year ЁЯПЖ  Sponsored by @NetworkSpaceltd ЁЯЩМ  This award recognises new start-up businesses, under two years old that have translated an idea into a successful business.  Apply now: https://www.sthelenschamber.com/business/st-helens-borough-business-awards/business-start-up-of-the-year/","Jun 23, 2022 ┬╖ 10:00 AM UTC",0,0
https://twitter.com/Leibniz_IPHT/status/1539906134001065984#m,"A team of scientists at Leibniz IPHT was awarded the Leibniz Start-up Prize from @LeibnizWGL for their idea of an optical toolbox that allows students & optics fans to easily design powerful #microscopy solutions. Congrats Ren├й, Barbora & Bene @OpenUc2! ЁЯСЙhttps://www.leibniz-ipht.de/en/high-resolution-microscopes-for-education-and-science-leibniz-ipht-team-awarded-with-the-leibniz-start-up-prize-2022/","Jun 23, 2022 ┬╖ 9:40 AM UTC",3,0
https://twitter.com/KillaLando/status/1539883735348305920#m,"Y'all don't see it: They've always sold a narrative that: 1. We don't have food. 2. Other than M-Pesa (which they talk about as a mulika mwizi reliant tech), we actually have nothing 3. We don't have money, & they can replicate any 'start-up' idea in the West in Africa, eg, Jumia","Jun 23, 2022 ┬╖ 8:11 AM UTC",0,0
https://twitter.com/WestmeathLEO/status/1539881260398551041#m,"Want to start your own business in County Westmeath?  If you have a business idea or an early stage start-up, join our popular Start Your Own Business course to learn all you need to know to make it a success!  Starts July 7th  Book at https://loom.ly/--c7HJ8 #makingithappen","Jun 23, 2022 ┬╖ 8:01 AM UTC",0,0
https://twitter.com/RochesterPR/status/1539881226680651776#m,"Our top start-up tip: Understand what #PR is - building mutually beneficial relationships between your company/brand and your audiences.┬а┬а Great #PR is carefully planned with time to formulate ideas, finesse messaging, and ensure the right people are being targeted.┬а #PRstrategy","Jun 23, 2022 ┬╖ 8:01 AM UTC",0,0
https://twitter.com/this_is_farm_uk/status/1539880964809170945#m,"Need a refresh when it comes to direction? Well we have just the solution for you! Whether you're a start-up wanting to know how to take your idea to the next level, or a scale-up struggling to find the right people, we can help!   #recruitment #agency #business #targets","Jun 23, 2022 ┬╖ 8:00 AM UTC",0,0
https://twitter.com/JollyHires/status/1539835808437309440#m,Which start-up idea has been your favorite so far? #Startup #Startupidea #ThursdayThoughts #JollyHires #ideas,"Jun 23, 2022 ┬╖ 5:00 AM UTC",3,0
